title,reply,cluster
犯罪时未满十六岁未满十八岁身份证已满十八岁应该怎样判,除非你可以拿出生证等其他证明对抗身份证，不然就以身份证为准,0
现在老房子翻新一下，属于违章建筑吗,一、按现行法律政策规定，如果推倒重建的，也必须事先经过审批，否则仍然是违法建筑；二、如果只是维修，并不是推倒重建，那怕绝大部分都改造了，仍然是维修，不需要审批。,2
个人债务纠纷律师费是多少,律师代理分为以下几种第一种：一般代理。依律师职业道德为当事人代理案件，维护当事人权利。一般为纠纷标的的3-5%。标的高的话也可以低于该比例。第二种：风险代理。按胜诉金额或以得到的金额的百分比支付代理费，或按减少的支付额的百分比支付代理费，比例当然高于一般代理。第三种：半风险代理。给一定的基本费用，其他的再按风险代理计算，当然就介于一般代理和风险代理的比例之间。,3
我在网络赌博上输了十几万能报警吗，我会承担什么责任,如果涉嫌赌博罪，刑事拘留最长37天，应当处三年以下有期徒刑。《中华人民共和国刑法》第三百零三条规定：以营利为目的，聚众赌博或者以赌博为业的，处三年以下有期徒刑、拘役或者管制，并处罚金。开设赌场的，处三年以下有期徒刑、拘役或者管制，并处罚金；情节严重的，处三年以上十年以下有期徒刑，并处罚金。,9
365律师咨询怎么收费,咨询可分为：现场口头咨询、当事人提供案件材料后律师提供咨询意见及法律方案；法律咨询是指提供法律知识问题的解答。由于法律的复杂性，非专业人士在遇到法律问题时，往往需要求助于律师一类的法律专业人士。律师收咨询费按计时收费，根据案件的复杂性和工作量及各地区不一样，知名度高的收费会高点，这个你要和律师协商，一般都是协商制。通常会根据问题的难易程度及回答问题所耗费的时间、精力评估收取费用。,3
离婚案件的审理有没有个期限,有期限简易程序从立案到开庭一般3个月，一般程序从立案到开庭一般6个月。审限开始时间从立案开始计算,10
在单位被同事打伤应该要怎样和解，赔偿准则,被他人打伤的，可以向伤人者索要医疗费、误工费、营养费、交通费、住院伙食补助费等费用。上述费用据实计算，以相关票据所载明的数额为准。如果构成伤残等级的，还可以要求赔偿伤残赔偿金。具体请查看《侵权责任法》和《最高人民法院关于审理人身损害赔偿案件适用法律若干问题的解释》。,10
未尽赡养义务的子女有继承权吗,根据《继承法》第十条的规定，子女之间享有对父母遗产的平等继承权。根据《中华人民共和国继承法》第十条规定：“遗产按照下列顺序继承：第一顺序：配偶、子女、父母。本法所说的子女，包括婚生子女、非婚生子女、养子女和有抚养关系的继子女。”同时，根据该法第七条规定：“继承人有下列行为之一的，丧失继承权：（一）故意杀害被继承人的；（二）为争夺遗产而杀害其他继承人的；（三）遗弃被继承人的，或者虐待被继承人情节严重的；（四）伪造、篡改或者销毁遗嘱，情节严重的。因此，虽然你的二妹和三弟未尽赡养父母的义务，且三弟属于养子，但依然享有法定继承权。不过，根据《中华人民共和国继承法》第十三条规定：“对被继承人尽了主要扶养义务或者与被继承人共同生活的继承人，分配遗产时，可以多分。有抚养能力和有抚养条件的继承人，不尽抚养义务的，分配遗产时，应当不分或者少分。”,0
现在法律上有重婚罪吗,我个人认为：第一、关于您提出的问题，适用《刑法》等法律文件的规定。第二、我国《刑法》第258条规定了重婚罪的构成和处罚。具体法律条文附后。第二百五十八条【重婚罪】有配偶而重婚的，或者明知他人有配偶而与之结婚的，处二年以下有期徒刑或者拘役。第三、如果您想了解其它与重婚罪相关的知识和信息，可通过百度的搜索引擎查询。具体方法是：在百度的搜索引擎的关键字段框内，输入“重婚罪”，即可浏览大量的相关页面。以后，如果您想了解其它方面的资料，既可以通过百度知道提问，也可以通过百度的搜索引擎自助查询。第四、综上，我的答复是：一是我国《刑法》有关于重婚罪的规定；二是重婚罪是指有配偶而重婚的，或者明知他人有配偶而与之结婚的，其处罚标准是处二年以下有期徒刑或者拘役。以上建议，仅供参考。,6
股东代表诉讼提起权与股东直接诉讼权有什么不,股东代表诉讼提起权与股东直接诉讼权的区别1、提起诉讼的前置条件。为了防止股东滥用诉权，《公司法》对股东提起代表诉讼设置了前置条件，即符合条件的股东在行使代表诉讼权前，必经先向公司监事会(或监事)、董事会(或执行董事)书面提出要求起诉的请求;股东直接诉讼的提起则没有限制条件。2、原告主体资格的限制。针对股东代表诉讼的特殊性，股份有限公司股东代表诉讼的主体资格受持股数、持股时间的限制;而对股东的直接诉讼没有进行主体资格的限制。3、胜诉后的利益归属。股东提起代表诉讼获得胜诉后，利益归于公司，提起诉讼的股东只是按照持股比例间接分享公司由此获得的利益;股东直接诉讼胜诉后，利益全部归属于该股东。4、行使目的。股东提起代表诉讼是因为作为被损害方的公司不积极主张权利，为了避免公司利益受损法律赋予股东代表公司提起诉讼的权利。股东提起代表诉讼的目的是避免公司利益受损、恢复公司的应有权利;而股东提起直接诉讼纯为维护自身利益，而非公司利益。因此，代表诉讼与直接诉讼在最终的目的上有区别。5、诉讼风险的承担。在代表诉讼中，起诉股东仅是代表公司行使诉权，实质意义上的诉权则归属公司。但是按照民事诉讼法的一般原则，由败诉方承担案件受理费和其它法定费用。即在代表诉讼中如股东败诉，由该股东负担该案诉讼费等费用。同时，该案判决对于公司产生既判力，公司其他股东及公司不得就同一理由再次提起代表诉讼。《公司法》没有对胜诉后，该股东垫付的费用如诉讼费及法定费用以外的律师费、差旅费等由谁承担作出规定，我认为这些费用应当由获得利益的公司承担。在直接诉讼中，提起诉讼的股东是形式上和实质上统一的原告，无论该股东胜诉、败诉，一切利益和不利益均归属该股东，而非其所持股份的公司，且不影响其他股东就该问题提起诉讼的权利。6、起诉范围。股东代表诉讼权的行使范围十分广泛，凡是公司依法所享有的诉权，只要公司管理机构拒绝或怠于行使，具备法定条件的股东均可依法提起诉讼;代表诉讼的被告是损害公司利益的侵权人，既可以是公司的大股东、董事、监事和公司管理人员，也可以是公司外的第三人。股东依据《公司法》提起的直接诉讼是作为公司法中的特定概念，其范围主要围绕法律法规、公司章程赋予的股东权利受到损害时行使;股东直接诉讼的被告是基于法律法规、公司章程规定行使公司管理权、经营权给股东利益造成损害的侵权人，即公司、公司的董事、监事和其他管理人员，但不得为公司外的第三人。,0
养父母有亲生子女养子女可否免除赡养义务,婚姻法第二十一条规定：“父母对子女有抚养教育的义务，子女对父母有赡养扶助的义务”,0
农村土地承包经营权证有何法律效力,农村土地承包经营权证是农村土地承包合同生效后，国家依法确认承包方享有土地承包经营权的法律凭证“延长土地承包期后，乡（镇）人民政府农业承包合同主管部门要及时向农户颁发由县或县级以上人民政府统一印制的土地承包经营权证书。”《农村土地承包法》第23条也规定：“县级以上地方人民政府应当向承包方颁发土地承包经营权证或者林权证等证书，并登记造册，确认土地承包经营权。”根据以上规定，土地承包经营权证书实际上代表着国家对于承包方承包权利的确认和保护，其有关“在承包期内实行增人不增地、减人不减地”等文字表述，实际上是引述国家规定。只要国家有关规定不变，这些内容就具有法律效力。,0
妨碍公务罪判刑不是暴力阻碍会怎么判他在,妨害公务罪在主观方面表现为故意，行为人必须是以暴力或者威胁的方法阻碍执行公务，企图迫使国家机关工作人员放弃执行职务。犯本罪的，处三年以下有期徒刑、拘役、管制或者罚金。虽然对执行职务有一定程度的妨害，但不能构成本罪的，对此种行为可以批评教育，或进行治安管理处罚。,5
当事人死亡继承人能终止合同吗,要看合同具体是什么类型，什么性质。您提供的信息有限，建议根据具体的情况咨询专业的律师。,0
借款不给起诉会胜诉吗,发生借款不还情况的时候，出借人不要抱着畏难的情绪对司法作不信任的猜测，而应该及时起诉到法院。法院的判决有利于定纷止争，判决对本金及利息的合法性判断是权利义务确定的基础，判决生效后，权益就非常明确了。对方如果不按照判决履行，还可以起算每日万分之一点七五的加倍利息。申请执行后，法院会采取多种强制执行手段，比如查询银行存款情况、限制其高消费、将被执行人列入失信被执行人名单、司法拘留等。,8
工作五年以上，如果自动辞职可以得到补偿吗,一般情况下，自动辞职得到补偿的概率很小，但如有很好的跳槽机会，补偿也没有那么重要了,8
新婚姻法，男女满18周就可以领结婚证，是真的吗,婚姻法规定是男22周岁，女20周岁才可以登记结婚，现在没有更改婚姻法，所以结婚年龄还是按照上述规定执行。,9
离职和辞职意思是一样的吗,离职和辞职的含义不一样。辞职即辞去职务，是劳动者向用人单位提出解除劳动合同或劳动关系的行为。辞职一般有三种情形：一是依法立即解除劳动关系，如用人单位对职工有暴力或威胁行为强迫其劳动、不按合同约定支付工资等，职工可以随时向用人单位提出解除劳动合同的要求；二是根据职工自己的选择，提前30日以书面形式通知用人单位解除劳动合同；三是向用人单位提出申请，双方协商一致解除合同。离职就是离开现有的职位。公私机关的工作人员因退休、辞职、停职、免职、死亡等原因，脱离其所担任的职位,8
公司实行大小周，每天工作9小时，周六加班没有工资算违法吗,看你劳动合同怎么签的，如果签的是月薪，月工资包括加班费，这样做就不违法，如果没签或没写清楚，就违法。,7
丈夫欲以离婚逃避责任，法院怎么判,我国《婚姻法》第二十条规定：“夫妻有互相扶养的义务，一方不履行扶养义务时，需要扶养的一方，有要求对方付给扶养费的权利。”夫妻之间互相扶养是公民法定的义务，有扶养能力的一方必须自觉履行这一义务，特别是在对方患病，或是丧失劳动能力的情况下更应该做到这一点。如果一方不履行这一法定义务，可通过法律途径实现自己的合法权益。又根据我国《婚姻法》第三十二条：有下列情形之一，调解无效的，应准予离婚：1、重婚或有配偶者与他人同居的；2、实施家庭暴力或虐待、遗弃家庭成员的；3、有赌博、吸毒等恶习屡教不改的；4、因感情不和分居满二年的；5、其他导致夫妻感情破裂的情形。一方被宣告失踪，另一方提出离婚诉讼的，应准予离婚。,4
什么是妨碍公务罪,妨害公务罪是指以暴力、威胁方法阻碍国家机关工作人员、人大代表依法执行职务，或者在自然灾害中和突发事件中，使用暴力、威胁方法阻碍红十字会工作人员依法履行职责，或故意阻碍国家安全机关、公安机关依法执行国家安全工作任务，虽未使用暴力，但造成严重后果的行为。《中华人民共和国刑法》第二百七十七条以暴力、威胁方法阻碍国家机关工作人员依法执行职务的，处三年以下有期徒刑、拘役、管制或者罚金。以暴力、威胁方法阻碍全国人民代表大会和地方各级人民代表大会代表依法执行代表职务的，依照前款的规定处罚。在自然灾害和突发事件中，以暴力、威胁方法阻碍红十字会工作人员依法履行职责的，依照第一款的规定处罚。故意阻碍国家安全机关、公安机关依法执行国家安全工作任务，未使用暴力、威胁方法，造成严重后果的，依照第一款的规定处罚。暴力袭击正在依法执行职务的人民警察的，依照第一款的规定从重处罚。第二百四十二条第一款以暴力、威胁方法阻碍国家机关工作人员解救被收买的妇女、儿童的，依照本法第二百七十七条的规定定罪处罚。,5
仅持转账凭证可以确证借贷关系吗有借据仍可能存在败诉,一、仅持转账凭证可以确证借贷关系吗不少当事人对于《规定》第十七条的解读存在偏差。不少人认为，原告只要提交转账凭证，就可高枕无忧，除非被告举证证明其不同主张完全成立，才发生举证责任的转移，原告才负有继续证明借贷关系成立的责任，否则败诉的风险一直由被告承担。个别原告据此故意隐瞒双方真实法律关系，仅凭转账凭证提起民间借贷诉讼，并将这种滥用诉权的行为称为诉讼策略。但在司法实践中适用《规定》第十七条时，被告的举证程度，只要达到动摇（而无需完全否定）借贷关系成立的程度，就会发生举证责任分配的转移，原告就必须进一步举证，否则就面临败诉。二、有借据仍可能存在败诉风险借据等债权凭证，虽然是认定借款事实的重要证据，但并非证明借款事实客观存在的充分条件。尤其是以现金方式交付的大额借款，出借人还应合理说明现金交付细节，并提出相关佐证，否则存在败诉风险。在借款（尤其是大额借款）交付时，宜采用银行转账方式，因为银行转账凭证、交易流水等证据容易获取和保存，即使凭证不慎遗失损毁，也可以补制或核查，而且此类证据的证明力较高。必须现金交付的，除要求对方出具收据外，最好拍摄现场照片、视频加以佐证，留存诸如取款凭证等出借资金来源的相关证据。,0
47岁从饭店楼梯掉下摔死饭店能赔偿多少,如果死者与饭店没有任何关系，死者是自杀，饭店不承担责任，如果失足掉下，饭店要承担责任。赔偿多少要结合综合情况考虑。,11
是我老公在服侍，那赔偿下来有没有护理费,有护理费护理费数额是由护理人员的收入状况、护理人数、护理期限、护理级别等要素综合决定的。护理人员的收入状况①护理人员有收入的，按照误工费的规定计算。②护理人员没有收入的，无论受害人是否实际支付给护理人员以报酬，均统一参照当地护工从事同等级别护理的劳务报酬标准计算。③受害人雇佣护工的，其计算方法与第二种情形相同。,7
离婚后关于想要回孩子抚养权的问题应该怎么,变更抚养权的条件《关于审理离婚案件处理子女抚养问题的若干意见》第16条规定，一方要求变更子女抚养权，有下列条件之一的，人民法院应予支持：1.与子女共同生活的一方因患严重疾病或因伤残无力继续抚养子女的。一方患病或者伤残，必然影响到对孩子的教育和照料，从孩子成长的角度出发，不是“如何变更抚养权?”的问题，而是必须要变更孩子抚养权问题。2.与子女一同生活的一方不尽抚养义务或有虐待行为的或其与子女共同生活对子女身心健康有不利影响的。有的父母离婚时争夺抚养权不是为了给孩子创造更好的生活条件，只是为了在财产分割或是为了达到报复的目的。目的一旦达到，就对孩子不管不问，不履行自己的抚养义务，有的还甚至对孩子打骂虐待。在这种情况下，如何变更抚养权?关心孩子成长的另一方可以要求变更离婚孩子抚养权。但是，变更抚养权不能要求重新分割原有的共同财产。3.十周岁以上未成年子女，愿随另一方生活的。十周岁以上的未成年人属于限制行为能力人，可以从事与其年龄相关的民事活动。父母离婚时，对于十周岁以上的子女的抚养权归属，应当听取孩子的意见。而在离婚时不满十周岁，过了几年，超过十周岁后，如果孩子明确表示愿意跟随另一方生活，就可以申请变更离婚孩子抚养权。4.有其它正当理由需要变更的。这是个兜底条款，社会现实是复杂的也是在不断发展的，对于那些制定司法解释时考虑不到的问题，司法解释赋予了法官一定的自由裁量权，在这里，如何变更抚养权?法官可以根据自己对客观情况的主观认识来判断是否应该变离婚孩子抚养权。根据以上规定，只要具有上述任意一个条件，即可向人民法院申请变更抚养权。,4
户口本上写的是未婚，可以办理离婚手续吗,不可以先带身份证户口簿和结婚证去户籍地派出所变更婚姻状况为已婚。,4
两伙人打架，派出所定为涉黑斗殴，请问能判刑吗,民法通则、治安管理处罚法、刑法分别对打架斗殴的后果、情节不同分别使用的法条，请对应了解：《中华人民共和国民法通则》第一百一十九条侵害公民身体造成伤害的，应当赔偿医疗费、因误工减少的收入、残废者生活补助费等费用；造成死亡的，并应当支付丧葬费、死者生前扶养的人必要的生活费等费用。《中华人民共和国治安管理处罚法》第二十六条有下列行为之一的，处五日以上十日以下拘留，可以并处五百元以下罚款；情节较重的，处十日以上十五日以下拘留，可以并处一千元以下罚款：（一）结伙斗殴的；（二）追逐、拦截他人的；（三）强拿硬要或者任意损毁、占用公私财物的；（四）其他寻衅滋事行为。第四十三条殴打他人的，或者故意伤害他人身体的，处五日以上十日以下拘留，并处二百元以上五百元以下罚款；情节较轻的，处五日以下拘留或者五百元以下罚款。有下列情形之一的，处十日以上十五日以下拘留，并处五百元以上一千元以下罚款：（一）结伙殴打、伤害他人的；（二）殴打、伤害残疾人、孕妇、不满十四周岁的人或者六十周岁以上的人的；（三）多次殴打、伤害他人或者一次殴打、伤害多人的。《中华人民共和国刑法》第二百三十四条故意伤害他人身体的，处三年以下有期徒刑、拘役或者管制。犯前款罪，致人重伤的，处三年以上十年以下有期徒刑；致人死亡或者以特别残忍手段致人重伤造成严重残疾的，处十年以上有期徒刑、无期徒刑或者死刑。本法另有规定的，依照规定。,7
法医鉴定.构成二级轻伤.可以私聊吗,涉嫌故意伤害罪故意伤害罪，是指故意非法伤害他人身体并达到一定的严重程度、应受刑法处罚的犯罪行为。《刑法》第二百三十四条规定：故意伤害他人身体的，处三年以下有期徒刑、拘役或者管制。犯前款罪，致人重伤的，处三年以上十年以下有期徒刑；致人死亡或者以特别残忍手段致人重伤造成严重残疾的，处十年以上有期徒刑、无期徒刑或者死刑。本法另有规定的，依照规定。,7
赌债非债，可以不还吗,1、无力偿还会面临法院后果的，建议及债权人积极协商，争取延迟还款。债权人也会起诉你，然后申请执行你的财产的。2、有能力而拒不执行的情况下，涉嫌拒不执行判决、裁定罪《刑法》第三百一十三条【拒不执行判决、裁定罪】对人民法院的判决、裁定有能力执行而拒不执行，情节严重的，处三年以下有期徒刑、拘役或者刑罚。3、另外名下没有可供执行的财产而他又拒绝履行法院的生效判决，则会有逾期还款等负面信息记录在个人的信用报告中并被限制高消费及出入境，甚至有可能会被司法拘留。,2
社保是不是五险一金？,五险一金”指的是五种社会保险(简称社保)以及一个公积金，“五险”包括养老保险、医疗保险、失业保险、工伤保险和生育保险;“一金”指的是住房公积金。其中养老保险、医疗保险和失业保险，这三种险是由企业和个人共同缴纳的保费;工伤保险和生育保险完全是由企业承担的，个人不需要缴纳。这里要注意的是“五险”是法定的，而“一金”不是法定的。五险一金的缴纳额度每个地区的规定都不同，基数是以工资总额为基数。有的企业在发放时有基本工资，有相关一些补贴，但有的企业在缴纳时，只是基本工资，这是违反法律规定的。,1
劳动法有规定高血压不能上夜班吗？,劳动法没有这么详细的规定，但是职业病防治法有规定有职业禁忌症的人员不能在具有相应职业危害的岗位上工作。就比如听力障碍不能从事噪声岗位，肺结核不能从事粉尘作业一样。体检机构会建议高血压患者不能从事高空、高温、噪声等具有较大刺激、危险性的工作，以及一些过度劳累繁重会加重诱发高血压、心脑血管疾病的工作。,1
签30年贷款免还协议。200万到手70万。到时候不还会怎么样,1、无力偿还会面临法院后果的，建议及债权人积极协商，争取延迟还款。债权人也会起诉你，然后申请执行你的财产的。2、有能力而拒不执行的情况下，涉嫌拒不执行判决、裁定罪《刑法》第三百一十三条【拒不执行判决、裁定罪】对人民法院的判决、裁定有能力执行而拒不执行，情节严重的，处三年以下有期徒刑、拘役或者刑罚。3、另外名下没有可供执行的财产而他又拒绝履行法院的生效判决，则会有逾期还款等负面信息记录在个人的信用报告中并被限制高消费及出入境，甚至有可能会被司法拘留。,2
