title,reply,cluster
一方有残疾可以离婚吗,可以协议离婚或者诉讼离婚的，法院判决离婚的标准是夫妻感情破裂,4
没带过孩子，能争取孩子抚养权吗,婚姻法规定的抚养权原则是，如果父母离婚，父母与子女的关系不因父母离婚而改变。子女抚养权，主要取决于抚养条件。主要有这样几条原则：1、一周岁以下的子女，判给母亲抚养；2、哺乳期内的子女原则上判给母亲抚养；3、自幼由祖父母看护的，原则上判给父亲抚养；自幼由外祖父母看护的，原则上判给母亲抚养；4、那方收入多，有利于孩子健康成长原则上把孩子判给谁抚养；5、一方如果有过错或家庭暴力倾向，原则上不把孩子判给这一方抚养；6、一方有不可治愈的传染性疾病或无法自理的疾病，不适合抚养孩子，原则上不能把孩子判给这一方；7、八周岁以上的孩子，要征求孩子意见，原则上按孩子的愿望判决。,4
是不是故意伤害，受害方有没有过错,要根据行为确定涉嫌故意伤害（致人重伤）罪，一般处三年以上十年以下有期徒刑。受害方有过错的，可以作为一个酌定情节（从轻）在量刑时考虑。法律依据：《刑法》第二百三十四条【故意伤害罪】故意伤害他人身体的，处三年以下有期徒刑、拘役或者管制。犯前款罪，致人重伤的，处三年以上十年以下有期徒刑;致人死亡或者以特别残忍手段致人重伤造成严重残疾的，处十年以上有期徒刑、无期徒刑或者死刑。本法另有规定的，依照规定。,6
算是持械斗殴吗但是他的朋友把人杀死了,民法通则、治安管理处罚法、刑法分别对打架斗殴的后果、情节不同分别使用的法条，请对应了解：《中华人民共和国民法通则》第一百一十九条侵害公民身体造成伤害的，应当赔偿医疗费、因误工减少的收入、残废者生活补助费等费用；造成死亡的，并应当支付丧葬费、死者生前扶养的人必要的生活费等费用。《中华人民共和国治安管理处罚法》第二十六条有下列行为之一的，处五日以上十日以下拘留，可以并处五百元以下罚款；情节较重的，处十日以上十五日以下拘留，可以并处一千元以下罚款：（一）结伙斗殴的；（二）追逐、拦截他人的；（三）强拿硬要或者任意损毁、占用公私财物的；（四）其他寻衅滋事行为。第四十三条殴打他人的，或者故意伤害他人身体的，处五日以上十日以下拘留，并处二百元以上五百元以下罚款；情节较轻的，处五日以下拘留或者五百元以下罚款。有下列情形之一的，处十日以上十五日以下拘留，并处五百元以上一千元以下罚款：（一）结伙殴打、伤害他人的；（二）殴打、伤害残疾人、孕妇、不满十四周岁的人或者六十周岁以上的人的；（三）多次殴打、伤害他人或者一次殴打、伤害多人的。《中华人民共和国刑法》第二百三十四条故意伤害他人身体的，处三年以下有期徒刑、拘役或者管制。犯前款罪，致人重伤的，处三年以上十年以下有期徒刑；致人死亡或者以特别残忍手段致人重伤造成严重残疾的，处十年以上有期徒刑、无期徒刑或者死刑。本法另有规定的，依照规定。,7
自从我生下儿子，能争取到孩子抚养权吗,新婚姻法规定的抚养权原则是，如果父母离婚，父母与子女的关系不因父母离婚而改变。子女抚养权，主要取决于抚养条件。主要有这样几条原则：1、一周岁以下的子女，判给母亲抚养；2、哺乳期内的子女原则上判给母亲抚养；3、自幼由祖父母看护的，原则上判给父亲抚养；自幼由外祖父母看护的，原则上判给母亲抚养；4、那方收入多，有利于孩子健康成长原则上把孩子判给谁抚养；5、一方如果有过错或家庭暴力倾向，原则上不把孩子判给这一方抚养；6、一方有不可治愈的传染性疾病或无法自理的疾病，不适合抚养孩子，原则上不能把孩子判给这一方；7、十周岁以上的孩子，要征求孩子一件，原则上按孩子的愿望判决。,9
婚姻存续中一方借款另一方不知道是否要有双方,一方借款是否属于夫妻共同债务，应当以实际案情作出判断，并不是所有的一方借款都属于共同债务。《婚姻法司法解释（二〉》第二十四条：“债权人就婚姻关系存续期间夫妻一方以个人名义所负债务主张权利的，应当按夫妻共同债务处理。但夫妻一方能够证明债权人与债务人明确约定为个人债务，或者能够证明属于婚姻法第十九条第三款规定情形的除外。”,0
与公司签了保密协议，有没有写工资里包含了保,《劳动合同法》第二十三条、第二十四条规定：用人单位与劳动者可以在劳动合同约定保守用人单位的商业秘密和与知识产权相关的保密事项。对负有保密义务的劳动者，用人单位可以在劳动合同或者保密协议中与劳动者约定竞业限制条款，并约定在解除或者终止劳动合同后，在竞业限制期限（二年）内按月给予劳动者经济补偿。劳动者违反竞业限制约定的，应当按照约定向用人单位支付违约金。竞业限制的人员限于用人单位高级管理人员、高级技术人员和其他负有保密义务的人员。竞业限制的范围、地域、期限由用人单位与劳动者约定，竞业限制的约定不得违反法律、法规的规定。在解除或者终止劳动合同后，前款规定的人员到与本单位生产或者经营同类产品、从事同类业务的有竞争关系的其他用人单位，或者自己开业生产或者经营同类产品、从事同类业务的竞业限制期限，不得超过二年。,1
醉驾处罚拘役多长时间期限为一个月以上六个月,醉驾构成危险驾驶罪，最高可处半年的拘役。《刑法》第一百三十三条【交通肇事罪】违反交通运输管理法规，因而发生重大事故，致人重伤、死亡或者使公私财产遭受重大损失的，处三年以下有期徒刑或者拘役；交通运输肇事后逃逸或者有其他特别恶劣情节的，处三年以上七年以下有期徒刑；因逃逸致人死亡的，处七年以上有期徒刑。在道路上驾驶机动车追逐竞驶，情节恶劣的，或者在道路上醉酒驾驶机动车的，处拘役，并处罚金。有前款行为，同时构成其他犯罪的，依照处罚较重的规定定罪处罚。,5
离婚多笔债务要求对方偿还，离婚债务与讨债有何区别,在夫妻离婚诉讼中，涉及夫妻债务时，会出现很多虚假债务，比如夫妻一方为了转移财产，与他人伪造债务，并在离婚时主张夫妻共同赔偿债务，以此在经济中得利。所以法院如果认定夫妻一方债务为夫妻共同债务，该债务必须在婚姻存续期间所借，且借款用于夫妻共同生活。“即使一方借款，另一方知情，但借款没有用于共同生活，也不算做共同债务。”在举证方面，主张的一方需要举证。大额支出举证还是不难的，如果大额负债用于夫妻共同生活，比如用于购买房产等，还是很容易举证的。曾经有一起离婚诉讼中，夫妻一方提出要将100万元的巨额债务归为共同债务，但其无法举证100万巨额借款用于夫妻共同生活，最终法院驳回其诉求。在该案件中，女方虽然拿出了4份民间借贷债务的判决书，证实自己确实拖欠了债务，但无法举证该债务用于共同生活支出，男方同样亦无法举证，因此法院不认可各自债务为共同债务，判决双方各自承担自己拖欠的债务。债权人一旦起诉夫妻，要求返回债务，法院一般会判决夫妻对债务均承担连带责任。只有个别情况除外，比如夫妻一方借钱时，在欠条上明确约定债务仅为夫妻一方承担。债权人起诉夫妻和夫妻离婚诉讼的判决并不互相违背，在债权人起诉夫妻的案件中，夫妻承担了连带责任，但两人可以在离婚诉讼中协商债务该如何负担。最高法司法解释曾规定，债权人就婚姻关系存续期间夫妻一方以个人名义所负债务主张权利的，应当按夫妻共同债务处理。但两种情况除外，第一种就是夫妻一方能够证明债权人与债务人明确约定为个人债务；第二种情况是夫妻对婚姻关系存续期间所得的财产约定归各自所有，夫或妻一方对外所负的债务，债权人知道该约定的，以夫或妻一方所有的财产清偿。最高法出台新的司法解释，针对司法实践中出现的涉及夫妻共同债务的新问题和新情况，作出规定，夫妻一方与第三人串通，虚构债务，第三人主张权利的，法院不予支持。夫妻一方在从事赌博、吸毒等违法犯罪活动中所负债务，第三人主张权利的，法院不予支持。,0
交通事故赔偿与责任有关系吗,交通事故损害赔偿一般是由当事人按过错承担责任、保险公司在保险份额内承担保险责任。其中交强险保险公司承担责任不分过错。,10
我的哥哥，无证驾驶撞死人，会被怎么处罚,无证驾驶撞人，构成交通肇事罪，一般来说没有加重情节的话应该判刑3年以下。根据《中华人民共和国刑法》第一百三十三条规定，违反交通运输管理法规，因而发生重大事故，致人重伤、死亡或者使公私财产遭受重大损失的，处三年以下有期徒刑或者拘役;交通运输肇事后逃逸或者有其他特别恶劣情节的，处三年以上七年以下有期徒刑;因逃逸致人死亡的，处七年以上有期徒刑。,7
医患双方和解有什么法律效力,医患双方的和解，在《医疗事故处理条例》第46条中有明确规定，发生医疗事故的赔偿等民事责任争议，医患双方可以协商解决。协商解决医疗纠纷是司法自治原则的具体体现。民事主体可以在符合法律规定的范围内自由处分自己的民事权利，因此医患双方当事人可以在法律允许的范围内对医疗事故的赔偿等责任的争议通过自行协商的方式加以解决。医患双方协商的成果协议书，具有民事合同的性质。因此，协议一经达成，双方当事人应当自觉履行。但是，由于其是一种私下协议，因此，对人民法院审理案件不具有约束力，任何一方当事人在协议达成后，仍然可以协议存在重大误解、显失公平等提起诉讼，不能因此产生剥夺或者限制一方当事人诉权的法律效力。但是和解协议书毕竟属于双方的和约，因此，对于已经达成协议的案件的审理，原则上人民法院应当按照合同纠纷来审理。不再按医疗赔偿合同纠纷案件审理。但调解协议无效或者需要撤销的除外。,10
什么是司法鉴定，申请司法鉴定的程序是怎样的,司法鉴定，是指在诉讼活动中鉴定人运用科学技术或者专门知识对诉讼涉及的专门性问题进行鉴别和判断并提供鉴定意见的活动。司法鉴定程序，是指司法鉴定机构和司法鉴定人进行司法鉴定活动的方式、步骤以及相关规则的总称。法条链接：司法部《司法鉴定程序通则》1、第二条司法鉴定是指在诉讼活动中鉴定人运用科学技术或者专门知识对诉讼涉及的专门性问题进行鉴别和判断并提供鉴定意见的活动。司法鉴定程序是指司法鉴定机构和司法鉴定人进行司法鉴定活动的方式、步骤以及相关规则的总称。2、第十一条司法鉴定机构应当统一受理办案机关的司法鉴定委托。3、第十二条委托人委托鉴定的，应当向司法鉴定机构提供真实、完整、充分的鉴定材料，并对鉴定材料的真实性、合法性负责。司法鉴定机构应当核对并记录鉴定材料的名称、种类、数量、性状、保存状况、收到时间等。诉讼当事人对鉴定材料有异议的，应当向委托人提出。本通则所称鉴定材料包括生物检材和非生物检材、比对样本材料以及其他与鉴定事项有关的鉴定资料。4、第十三条司法鉴定机构应当自收到委托之日起七个工作日内作出是否受理的决定。对于复杂、疑难或者特殊鉴定事项的委托，司法鉴定机构可以与委托人协商决定受理的时间。5、第十四条司法鉴定机构应当对委托鉴定事项、鉴定材料等进行审查。对属于本机构司法鉴定业务范围，鉴定用途合法，提供的鉴定材料能够满足鉴定需要的，应当受理。对于鉴定材料不完整、不充分，不能满足鉴定需要的，司法鉴定机构可以要求委托人补充；经补充后能够满足鉴定需要的，应当受理。6、第十五条具有下列情形之一的鉴定委托，司法鉴定机构不得受理：（一）委托鉴定事项超出本机构司法鉴定业务范围的；（二）发现鉴定材料不真实、不完整、不充分或者取得方式不合法的；（三）鉴定用途不合法或者违背社会公德的；（四）鉴定要求不符合司法鉴定执业规则或者相关鉴定技术规范的；（五）鉴定要求超出本机构技术条件或者鉴定能力的；（六）委托人就同一鉴定事项同时委托其他司法鉴定机构进行鉴定的；（七）其他不符合法律、法规、规章规定的情形。7、第十六条司法鉴定机构决定受理鉴定委托的，应当与委托人签订司法鉴定委托书。司法鉴定委托书应当载明委托人名称、司法鉴定机构名称、委托鉴定事项、是否属于重新鉴定、鉴定用途、与鉴定有关的基本案情、鉴定材料的提供和退还、鉴定风险，以及双方商定的鉴定时限、鉴定费用及收取方式、双方权利义务等其他需要载明的事项。8、第十七条司法鉴定机构决定不予受理鉴定委托的，应当向委托人说明理由，退还鉴定材料。9、第十八条司法鉴定机构受理鉴定委托后，应当指定本机构具有该鉴定事项执业资格的司法鉴定人进行鉴定。委托人有特殊要求的，经双方协商一致，也可以从本机构中选择符合条件的司法鉴定人进行鉴定。委托人不得要求或者暗示司法鉴定机构、司法鉴定人按其意图或者特定目的提供鉴定意见。,3
知识产权贯标条件条件是什么？需要什么资料吗？,条件：1.建立文件化的知识产权管理体系并实施运行三个月以上2.至少完成一次内部审核和管理评审3.知识产权管理体系运行期间及建立体系前的一年内未受到主管部门行政处罚。中规公司的认证申请要求的条件是完全一样的。,8
离婚财产法院判决后，对方没有钱给，可以分期吗,生效法律文书中具有履行义务的人在规定的期限内未履行，享有权利的一方可以申请法院强制执行。在强制执行过程中，发现被申请人确实没有可执行的财产，双方可以在执行法官的主持下达成执行和解，确定还款时间、方式。总之，是否愿意接受分期，是债权人的权利。,4
"房屋确权案被告赢了,律师费谁出",败诉不一定要承担对方的律师费，要看之前是否对律师费谁承担有明确约定,11
私自倒卖柴油什么罪怎么处罚要判刑吗,根据法律规定，如果没有许可证，个人倒卖柴油是违法的。如果买卖的数量较大，涉嫌构成非法经营罪。根据我国刑法，根据情节严重程度予以处罚，具体规定如下：《刑法》第二百二十五条违反国家规定，有下列非法经营行为之一，扰乱市场秩序，情节严重的，处五年以下有期徒刑或者拘役，并处或者单处违法所得一倍以上五倍以下罚金；情节特别严重的，处五年以上有期徒刑，并处违法所得一倍以上五倍以下罚金或者没收财产：（一）未经许可经营法律、行政法规规定的专营、专卖物品或者其他限制买卖的物品的；（二）买卖进出口许可证、进出口原产地证明以及萁他法律、行政法规规定的经营许可证或者批准文件的；（三）未经国家有关主管部门批准非法经营证券、期货、保险业务的，或者非法从事资金支付结算业务的；（四）其他严重扰乱市场秩序的非法经营行为。,3
法院判决赔偿款收条应该怎么写,收条今收到XXX赔偿金人民币XXX元整，特立此为证。赔偿人签字：XXX查收人签字：XXX日期:XXXX年XX月XX日,3
怎样理解依法纳税是公民的基本义务,"我国社会主义税收取之于民,用之于民.在我国,国家利益、集体利益、个人利益在根本上是一致的.国家的兴旺发达、繁荣富强与每个公民息息相关；而国家职能的实现,必须以社会各界缴纳的税收为物质基础.因而,在我国每个公民都应自觉纳税.每个公民都应该具有主人翁意识,依法纳税是公民的义务.自觉纳税是公民社会责任感和国家主人翁地位的具体体现,每个公民应该自觉诚实纳税,履行公民的基本义务.在现实生活中,一些单位和个人存在偷漏税、欠税、骗税、抗税的违反税法的现象.这些行为,即危害社会经济健康发展、国家和人民的根本利益,也直接影响个人的健康成长.因而,我们必须坚决同任何违反税法的行为作斗争,以维护国家的根本利益.要以主人翁的态度和高度责任感,积极关注国家对税收的征管和使用,以维护公民自身的合法权益.",10
在一个事业单位工作7年了，刚续聘5年，如果单位想辞退我会怎么做？会有什么损失？怎么把,"根据《劳动合同法》第46条规定,用人单位按照上述第36条、第40条、第41条的规定解除劳动关系的,应当向劳动者支付经济补偿。第47条规定,经济补偿按劳动者在本单位工作的年限,每满一年支付一个月工资的标准向劳动者支付。六个月以上不满一年的,按一年计算;不满六个月的,向劳动者支付半个月工资的经济补偿。月工资是指劳动者在劳动合同解除或者终止前十二个月的平均工资。除了上述情形以外,用人单位辞退员工的,就属于违法解除劳动合同,要按照经济补偿标准的二倍向劳动者支付赔偿金,即按劳动者在本单位工作的年限,每满一年支付二个月工资的标准向劳动者支付。六个月以上不满一年的,按一年计算;不满六个月的,向劳动者支付一个月工资的赔偿金。",9
临时工上班时受伤算工伤吗，因此不能上班有误工费吗,1、临时工受伤，误工费按临时工的工资收入全额赔偿；2、临时工是一个俗称，不是法律名称，所有与用人单位建立劳动关系的劳动者，都受到法律的保护，临时工也是劳动者的一分子，受伤后可以申请工伤认定，停工留薪期间，工资待遇不变，由用人单位按月支付；3、法律依据《工伤保险条例》第十四条职工有下列情形之一的，应当认定为工伤：（一）在工作时间和工作场所内，因工作原因受到事故伤害的；（二）工作时间前后在工作场所内，从事与工作有关的预备性或者收尾性工作受到事故伤害的；（三）在工作时间和工作场所内，因履行工作职责受到暴力等意外伤害的；（四）患职业病的；（五）因工外出期间，由于工作原因受到伤害或者发生事故下落不明的；（六）在上下班途中，受到非本人主要责任的交通事故或者城市轨道交通、客运轮渡、火车事故伤害的；（七）法律、行政法规规定应当认定为工伤的其他情形。第三十三条职工因工作遭受事故伤害或者患职业病需要暂停工作接受工伤医疗的，在停工留薪期内，原工资福利待遇不变，由所在单位按月支付。,1
检察院自侦案件取保候审是否有保证人权利义务告知书,是的，检察院邮寄来一份犯罪嫌疑人权利义务告知书，意思是说检察院要将案子起诉到法院了，犯罪嫌疑人可以请律师作为开庭准备，有什么问题可以反映给检察院。,0
如何对付欠钱不还的人,1、对于欠债不还的，你可以选择起诉，前提是有证据，并且在诉讼时效以内。2、证据包括欠条、录音、付款凭证等都可以，而且借据要是原始的，不能经过任何的涂改或者复印等加工。3、注明还款日期的，诉讼时效从借条到期之日起两年内；没有还款日期的，随时可以要求还款，从第一次追讨之日起两年内就可以。4、法院判决后，如果对方不还可以申请法院强制执行，对债务人恶意拖欠的还可以拘留。债务人去世的，可以从其遗产中进行清偿。,11
暴力袭击正在执行公务的警察,一、《中华人民共和国人民警察法》第三十五条拒绝或者阻碍人民警察依法执行职务，有下列行为之一的，给予治安管理处罚：（一）公然侮辱正在执行职务的人民警察的；（二）阻碍人民警察调查取证的；（三）拒绝或者阻碍人民警察执行追捕、搜查、救险等任务进入有关住所、场所的；（四）对执行救人、救险、追捕、警卫等紧急任务的警车故意设置障碍的（五）有拒绝或者阻碍人民警察执行职务的其他行为的。以暴力、威胁方法实施前款规定的行为，构成犯罪的，依法追究刑事责任。二、《中华人民共和国刑法》第二百七十七条第一款、第四款以暴力、威胁方法阻碍国家机关工作人员依法执行职务的，处三年以下有期徒刑、拘役、管制或者罚金。故意阻碍国家安全机关、公安机关依法执行国家安全工作任务，未使用暴力、威胁方法，造成严重后果的，依照第一款的规定处罚。三、《中华人民共和国治安管理处罚法》（2006年3月1日起执行）第五十条有下列行为之一的，处警告或者二百元以下罚款；情节严重的，处五日以上十日以下拘留，可以并处五百元以下罚款：（一）拒不执行人民政府在紧急状态情况下依法发布的决定、命令的；（二）阻碍国家机关工作人员依法执行职务的；（三）阻碍执行紧急任务的消防车、救护车、工程抢险车、警车等车辆通行的；（四）强行冲闯公安机关设置的警戒带、警戒区的。阻碍人民警察依法执行职务的，从重处罚。,5
犯罪心理与犯罪行为有哪些区别,理论上，具有犯罪心理不一定会有犯罪行为，比如思想犯罪不是犯罪；具有犯罪行为也不一定具有犯罪心理，比如，激情犯罪、误伤等，两者没有必然的联系。但客观上，犯罪心理催生犯罪行为，犯罪行为为下一次的犯罪心理提供实践基础。,10
儿子代款不还法院送起,1、无力偿还会面临法院后果的，建议及债权人积极协商，争取延迟还款。债权人也会起诉你，然后申请执行你的财产的。2、有能力而拒不执行的情况下，涉嫌拒不执行判决、裁定罪《刑法》第三百一十三条【拒不执行判决、裁定罪】对人民法院的判决、裁定有能力执行而拒不执行，情节严重的，处三年以下有期徒刑、拘役或者刑罚。3、另外名下没有可供执行的财产而他又拒绝履行法院的生效判决，则会有逾期还款等负面信息记录在个人的信用报告中并被限制高消费及出入境，甚至有可能会被司法拘留。,11
网贷还不上算诈骗吗诈骗的鉴别标准是怎样的,"一、网贷还不上算诈骗吗,诈骗的判断方式是怎样的根据司法实践，对于行为人通过诈骗的方法非法获取资金，造成数额较大资金不能归还，并具有下列情形之一的，可以认定为具有非法占有的目的：(1)明知没有归还能力而大量骗取资金的(2)非法获取资金后逃跑的(3)肆意挥霍骗取资金的(4)使用骗取的资金进行违法犯罪活动的(5)抽逃、转移资金、隐匿财产，以逃避返还资金的(6)隐匿、销毁账目，或者搞假破产、假倒闭，以逃避返还资金的(7)其他非法占有资金、拒不返还的行为。二、网贷不还影响征信1、如果一个人的个人征信出现了问题，在申请信用贷款的时候是肯定会被拒的。因为信用贷款，顾名思义就是凭借借款者的个人信用来获得贷款的，如果信用有问题，放款机构会觉得这类人还款意愿不强，贷款机构所要承担的风险就较大，所以无论是银行还是合格的小贷公司都不会把钱借给这样的人的。2、另外，个人征信除了会对信用贷款的申办有一定影响之外，办理房贷也是与个人征信的好坏挂钩的。一般在申请房贷的时候，银行首先就会查看借款者的征信报告，如果之前有过逾期情况并且情节严重(严重的标准就是近两年内连续逾期超过3次或者是累计逾期超过6次)的话，房贷也是很难的。不过，如果借款者之前逾期次数少、金额小的话，申办房贷还是有希望的，不过可能贷款利率会比一般人高一些，额度上也会有所下降。",3
