title,reply,cluster
道路清洁工在道路上扫垃圾被车撞，算不算工伤,根据《工伤保险条例》第十四条中对工伤的认定，职工有下列情形之一的，应当认定为工伤：（一）在工作时间和工作场所内，因工作原因受到事故伤害的；（二）工作时间前后在工作场所内，从事与工作有关的预备性或者收尾性工作受到事故伤害的；（三）在工作时间和工作场所内，因履行工作职责受到暴力等意外伤害的；（四）患职业病的；（五）因工外出期间，由于工作原因受到伤害或者发生事故下落不明的；（六）在上下班途中，受到非本人主要责任的交通事故或者城市轨道交通、客运轮渡、火车事故伤害的；（七）法律、行政法规规定应当认定为工伤的其他情形。需要专业机构鉴定，以鉴定结果为准。单位未在出事30天内申请的，员工及家属应在出事后一年内先行工伤认定，再伤残鉴定，然后索赔。工伤赔偿包括：医疗费、停工留薪期工资、住院伙食补助、护理费、交通费住住宿费、一次性伤残补助金，如解除劳动关系的，还有一次性就业补助金和一次性医疗补助金，等等。具体数额须结合本人工资和当地标准等情况确定。,5
谈对象时算不算强奸,根据《中华人民共和国刑法》第二百三十六条的规定，强奸罪，是指违背妇女意志，使用暴力、胁迫或者其他手段，强行与妇女发生性交的行为，[1]或者故意与不满14周岁的幼女发生性关系的行为。,5
"公司把我们换到别人的公司,会陪尝我们吗",法律依据《劳动合同法》第三十三条用人单位变更名称、法定代表人、主要负责人或者投资人等事项，不影响劳动合同的履行。第四十条有下列情形之一的，用人单位提前三十日以书面形式通知劳动者本人或者额外支付劳动者一个月工资后，可以解除劳动合同：（一）劳动者患病或者非因工负伤，在规定的医疗期满后不能从事原工作，也不能从事由用人单位另行安排的工作的；（二）劳动者不能胜任工作，经过培训或者调整工作岗位，仍不能胜任工作的；（三）劳动合同订立时所依据的客观情况发生重大变化，致使劳动合同无法履行，经用人单位与劳动者协商，未能就变更劳动合同内容达成协议的。第四十六条有下列情形之一的，用人单位应当向劳动者支付经济补偿：（一）劳动者依照本法第三十八条规定解除劳动合同的；（二）用人单位依照本法第三十六条规定向劳动者提出解除劳动合同并与劳动者协商一致解除劳动合同的；（三）用人单位依照本法第四十条规定解除劳动合同的；（四）用人单位依照本法第四十一条第一款规定解除劳动合同的；（五）除用人单位维持或者提高劳动合同约定条件续订劳动合同，劳动者不同意续订的情形外，依照本法第四十四条第一项规定终止固定期限劳动合同的；（六）依照本法第四十四条第四项、第五项规定终止劳动合同的；（七）法律、行政法规规定的其他情形。第四十七条经济补偿按劳动者在本单位工作的年限，每满一年支付一个月工资的标准向劳动者支付。六个月以上不满一年的，按一年计算；不满六个月的，向劳动者支付半个月工资的经济补偿。劳动者月工资高于用人单位所在直辖市、设区的市级人民政府公布的本地区上年度职工月平均工资三倍的，向其支付经济补偿的标准按职工月平均工资三倍的数额支付，向其支付经济补偿的年限最高不超过十二年。本条所称月工资是指劳动者在劳动合同解除或者终止前十二个月的平均工资。,7
合同签了可以反悔吗,可已经行协商，协商不成除非是具有任意解除权的合同，否则一般的合同都不能反悔，否则要承担违约责任的。,8
机动车开车门撞致电动车受害者头部着地，怎么划分肇事者的赔偿？,建议及时报警处理的，根据交警出具的事故认定书划分责任的，然后申请伤残鉴定，进而根据事故认定书以及伤残等级报告协商确定赔偿金额的。,1
退房必须要退房协议吗,想要退房的话还是要填写退房协议，而且不是你想要退房就可以申请退房的，必须在你符合购房合同的退房条件下，才可以申请退房。也就是首先需与房地产开发商协商并达成退房协议，然后再到相关部门进行注销手续。一、签订退房协议要注意的问题：1、约定索要违约金及相关税费如果是开发商违约导致退房，双方也在合同里约定了违约金，那么开发商须按约定赔偿。赔偿金除了房屋全价款及相应的利息外，还包括业主前期已支出的一些费用，如印花税、购房契税、交易手续费、测绘费、登记费、利息损失、购房代理费及律师费等，这些都算入消费者实际损失范围内，由开发商补偿。2、明确约定首付、月供利息都可获赔在退房款方面，采用一次性付款的购房者可直接要求开发商退还自己所付款项及相应利息。但通过按揭贷款、公积金贷款买房的情况则要相对复杂些。实践中，都是开发商将应退购房款分成两部分，属于买家首付款的部分直接退还给买家，属于买家向银行借款的部分直接交还给银行，并视为买家已向银行提前还款。银行接收还款并终止与购房人的借款合同。开发商支付购房人首付款利息，即从首付款交付日到开发商归还日该笔首付款的利息收入。若购房人按揭贷款已进入月供阶段，开发商同样应归还购房人月供及利息支出。若购房者要求退房时，已居住了一段时间，这期间产生的折旧费应由业主补偿。在退房中，若责任方为开发商，购房者可不对房屋折旧进行补偿，若是购房者的责任，开发商则可以不赔偿业主装修费。3、明确约定补偿条件如果满足合同约定的退房条件，最好还是先与开发商进行协商，这样可以省去诉讼费用。如果开发商提出的补偿条件能使业主满意，业主可根据自身情况收回退房要求，或在开发商协助下办理退房手续。如协调未果再选择诉讼或仲裁。,8
生的孩子，没交纳社会抚养费，现在，国家要求还征收吗,还征收不交社会抚养费如果有可执行财产，计划生育部门可以向法院申请强制执行。逾期不缴纳社会抚养费，计划生育部门可以加收罚金。确实没有缴纳能力，也无可执行财产，可以办理缓交手续，法院裁定中止执行。不缴纳社会抚养费，最大的问题还是孩子没办法落户。,9
写离婚协议书能离婚吗,签离婚协议书应注意的几个问题一、应详细、准确填写夫妻双方的有关身份资料。包括：姓名、曾用名、出生年月、民族、户籍住址、常住地址、身份证号码、联系电话等，由此可确定离婚双方在法律角度上的身份特征，确保协议订立当事人的Ψ一性。二、夫妻双方协议离婚的原因应作出简要表述。比如“夫妻双方因感情不和”等;假如表述为“夫(或妻)一方因婚外情”，则可能存在无过错一方在离婚后发现其他未分割的夫妻共同财产时，以另一方存在婚外情导致离婚存在过错为由，在再次分割夫妻共同财产中主张分得该财产大部分或全部。三、离婚协议的主要内容包括共同财产分割、个人财产处理和子女抚养权等，该部分内容是离婚协议的核心内容，应作出详细的约定。(一)夫妻共同财产的分割(二)夫或妻个人财产处理(三)对于子女抚养权的处理四、协议的份数离婚协议一般至少一式三份，协议当事人各一份，民政部门一份。五、协议的附件为使协议内容完整和便于操作，建议在协议书后附上夫妻双方的身份证复印件、有形财产照片等材料。六、其他离婚协议一般要约定“本协议自双方签字时生效”的字样，最好协议双方在签字后加按手印，并写上签订协议的时间。,4
两辆电动车相撞一方喝酒一方逆行责任算谁的,立即报警，责任由交警现场调查后裁定。当事人都有过错，自己无法裁定。当然，如果双方损失不大，受伤不重，能够协商处理最好。,11
醉驾被判刑后，能不能申请监外执行,醉驾被判刑后，申请监外执行的是要符合以下条件的：对被判处有期徒刑或者拘役的罪犯，有下列情形之一的，可以暂予监外执行：（一）有严重疾病需要保外就医的；（二）怀孕或者正在哺乳自己婴儿的妇女；（三）生活不能自理，适用暂予监外执行不致危害社会的。对被判处无期徒刑的罪犯，有前款第二项规定情形的，可以暂予监外执行。对适用保外就医可能有社会危险性的罪犯，或者自伤自残的罪犯，不得保外就医。对罪犯确有严重疾病，必须保外就医的，由省级人民政府指定的医院诊断并开具证明文件。在交付执行前，暂予监外执行由交付执行的人民法院决定；在交付执行后，暂予监外执行由监狱或者看守所提出书面意见，报省级以上监狱管理机关或者设区的市一级以上公安机关批准。,6
工伤没有鉴定到等级，能够得到多少赔偿,工伤鉴定没有评到伤残级别的，可以按《工伤保险条例〉的规定，享受以下工伤待遇的。1、工伤医疗期间的工资由用人单位按受伤前标准进行支付的。2、产生的如下费用可以报销的。〈社会保险法〉第三十八条因工伤发生的下列费用，按照国家规定从工伤保险基金中支付：（一）治疗工伤的医疗费用和康复费用；（二）住院伙食补助费；（三）到统筹地区以外就医的交通食宿费；（四）安装配置伤残辅助器具所需费用；（五）生活不能自理的，经劳动能力鉴定委员会确认的生活护理费；（六）一次性伤残补助金和一至四级伤残职工按月领取的伤残津贴；（七）终止或者解除劳动合同时，应当享受的一次性医疗补助金；（八）因工死亡的，其遗属领取的丧葬补助金、供养亲属抚恤金和因工死亡补助金；（九）劳动能力鉴定费。,10
诈骗40万元怎么量刑“股神”荐股诈骗40万小,《刑法》第二百六十六条规定：诈骗公私财物，数额较大的，处三年以下有期徒刑、拘役或者管制，并处或者单处罚金；数额巨大或者有其他严重情节的，处三年以上十年以下有期徒刑，并处罚金；数额特别巨大或者有其他特别严重情节的，处十年以上有期徒刑或者无期徒刑，并处罚金或者没收财产。本法另有规定的，依照规定。,11
打官司请律师是怎样程序,"程序如下：1、应与律师协商,确定服务标准和收费项目.(一般为代理费和交通费)2、一般为先付费,在签完代理合同后付费.3、同时可以采用风险代理方式，在案件办理完毕后支付代理费，不过这种方式应比上一种方式收费高。4、如果实在无钱支付，也可以到各地的法律援助中心申请法律援助，不收费。",3
本月1号上班下个月25号发工资是压多少天的工,你一号上班。这个月25号发上个月的工资所以你没有。下个月25发这个月工资，所以，压25天的~,1
"做完手术十天内死亡的,算医疗事故吗?","如果医疗机构存在违反医疗卫生管理法律、行政法规、部门规章和诊疗护理规范、常规的过失行为，造成患者人身损害的,才属于医疗事故,医疗机构存有过错的才承担责任。可以进行医疗事故鉴定",1
涉嫌犯罪被限制人身自由，单位可否以旷工为由解除合同,不可以算作旷工，可以作为劳动合同中止，停发工资和保险，返岗后恢复。如果有刑事处罚，单位可以无偿解除劳动合同。,0
农民工工地上意外死亡，赔偿金怎么赔偿，能赔偿,工伤死亡赔偿金分以下三类：1、丧葬补助金：为6个月的统筹地区上年度职工月平均工资；2、供养亲属抚恤金：按照职工本人工资的一定比例发给由因工死亡职工生前提供主要生活来源、无劳动能力的亲属。标准为：配偶每月40%（要求你母亲年满55周岁），其他亲属没人每月30%。其中：“无劳动能力”是指：工亡职工配偶男年满60周岁、女年满55周岁的;工亡职工父母男年满60周岁、女年满55周岁的;工亡职工子女未满18周岁的;工亡职工父母均已死亡，其祖父、外祖父年满60周岁，祖母、外祖母年满55周岁的;工亡职工子女已经死亡或完全丧失劳动能力，其孙子女、外孙子女未满18周岁的;工亡职工父母均已死亡或完全丧失劳动能力，其兄弟姐妹未满18周岁的。3、一次性工亡补助金：标准为48个月至60个月的统筹地区上年度职工月平均工资,1
法律咨询服务有限公司的经营范围,(一）经营范围是指国家允许企业生产和经营的商品类别、品种及服务项目，反映企业业务活动的内容和生产经营方向，是企业业务活动范围的法律界限，体现企业民事权利能力和行为能力的核心内容。(二）法律咨询公司主要做：事经济纠纷、刑事诉讼、法律顾问、劳动纠纷、合同纠纷、房地产纠纷、商业纠纷、建筑工程纠纷、刑事辩护、交通事故、医疗等法律事故律师服务,10
如果.我去卖淫.一个月不知道有多少钱收入,现在对卖淫的处罚1、《治安管理处罚法》第六十六条规定：卖淫、嫖娼的，处十日以上十五日以下拘留，可以并处五千元以下罚款;情节较轻的，处五日以下拘留或者五百元以下罚款。在公共场所拉客招嫖的，处五日以下拘留或者五百元以下罚款。2、在以前，第一次卖淫被抓的，一般处以拘留、罚款；再次被抓的，属于屡教不改，一般是处以6个月到2年的劳动教养。现在没有劳动教养了。对于卖淫、嫖娼的，只能处：十日以上十五日以下拘留，可以并处五千元以下罚款；情节较轻的，处五日以下拘留或者五百元以下罚款。,7
人社部军人保险法不菅你在哪里干社会保险接着算,至少在我们社保，是可以办理保险落户的，但是只能办理管辖区内的军人社保落户，您应该咨询您户口所在地区（县）级社保局办理,11
如何认定校园伤害事故，校园伤害事故责任谁来,一、如何认定校园伤害事故？所谓的校园伤害事故，是指在学校实施的教育活动或学校组织的校外活动中，以及在学校负有管理责任的校舍、场地、其他教学设施、生活设施内所发生的造成在校生人身权受到损害，导致其受伤、残疾或死亡的人身伤害事故。学校伤害事故具有自己的特点：一是损害的主体是特定的，受害主体只能是在学校学习、生活的学生，包括公立、私立学校中走读制和寄宿制的学生。二是损害地点是特定的，学生损害的地点必须是在学校园内及学校组织校外活动的特定场所。三是损害时间是特定的，学生受损害是发生在学生在校学习、生活期间以及学校组织的补习期间，学生离开学校时的非学习、生活期间除外。二、校园伤害事故责任谁来承担？《侵权责任法》第38条规定:“无民事行为能力人在幼儿园学校或者其他教育机构学习、生活期间受到人身损害的，幼儿园、学校或者其他教育机构应当承担责任，但能够证明尽到教育管理职责的，不承担责任。”第39条规定：“限制民事行为能力人在学校或者其他教育机构学习、生活期间受到人身损害，学校或者其他教育机构未尽到教育、管理职责的，应当承担责任。”第40条规定：“无民事行为能力人或者限制民事行为能力人在幼儿园、学校或者其他教育机构学习生活期间，受到幼儿园、学校或者其他教育机构以外的人员人身伤害的，由侵权人承担侵权责任；幼儿园、学校或者其他教育机构未尽到管理职责的，承担相应的补充责任。”依据上述法律规定，可以清晰地看出，当校园伤害事故发生后，学校是否应当承担法律责任，应当承担什么样的法律责任，首先应当分析受伤害人是无民事行为能力人还是限制行为能力人，如果是无民事行为能力人即10周岁以下的儿童受到伤害，则学校或者其他教育机构就应当承担法律责任，除非学校或者其他教育机构有证据证明其尽到了教育管理职责，采用的是一种举证责任倒置方式；如果是限制行为能力人即10周岁以上的未成年人受到伤害，则只有在受伤害人能够举证证明学校未尽到教育、管理职责的情况时，学校承担相应的法律责任。其次还应当分析受伤害人所遭受的伤害是来自学校还是学校以外人员的伤害，如果是学校以外人员所造成的伤害，则应当由侵权人承担相应的法律责任，但如果受伤害人能够举证证明学校在其受伤害时未尽到管理职责，则学校承担补充责任。以上就是对如何认定校园伤害事故，校园伤害事故责任谁来承担问题的解答。作为父母，一定要用科学的教育方法与孩子沟通各种问题，同时言传身教，潜移默化中培养孩子的自我保护意识和尊重他人的思想，从而使孩子既不伤害他人，也不被伤害。作为学校，应加强学生思想品德和法制教育，增强孩子的自我保护意识，同时还应加强学校安全管理，减少甚至避免人身伤害危险发生的可能性。,10
利息多少算高利贷高利贷不还的真实后果是什么,但根据《合同法》第二百一十一条规定：“自然人之间的借款合同约定支付利息的，借款的利率不得违反国家有关限制借款利率的规定”。依据《最高人民法院关于审理民间借贷案件适用法律若干问题的规定》，借贷双方约定的利率未超过年利率24%，出借人有权请求借款人按照约定的利率支付利息；但如果借贷双方约定的利率超过年利率36%，则超过年利率36%部分的利息应当被认定无效。《最高人民法院关于审理民间借贷案件适用法律若干问题的规定》第二十六条借贷双方约定的利率未超过年利率24%，出借人请求借款人按照约定的利率支付利息的，人民法院应予支持。借贷双方约定的利率超过年利率36%，超过部分的利息约定无效。借款人请求出借人返还已支付的超过年利率36%部分的利息的，人民法院应予支持。,2
员工在什么情况下主动离职可以拿到补偿金呢？,1、若是用人单位有过错，如第三十八条：“用人单位有下列情形之一的，劳动者可以解除劳动合同：(一)未按照劳动合同约定提供劳动保护或者劳动条件的;(二)未及时足额支付劳动报酬的;(三)未依法为劳动者缴纳社会保险费的;(四)用人单位的规章制度违反法律、法规的规定，损害劳动者权益的;(五)因本法第二十六条第一款规定的情形致使劳动合同无效的;(六)法律、行政法规规定劳动者可以解除劳动合同的其他情形。用人单位以暴力、威胁或者非法限制人身自由的手段强迫劳动者劳动的，或者用人单位违章指挥、强令冒险作业危及劳动者人身安全的，劳动者可以立即解除劳动合同，不需事先告知用人单位。”在有以上情形之一的，劳动者可以立刻辞职并可以要求用人单位补偿。2、如果是用人单位没有过错，员工提出辞职，适用《劳动合同法》第三十七条：“劳动者提前三十日以书面形式通知用人单位，可以解除劳动合同。劳动者在试用期内提前三日通知用人单位，可以解除劳动合同。”这是没有补偿或赔偿的。,1
男方离婚要孩子抚养权吗,婚姻法规定的抚养权原则是，如果父母离婚，父母与子女的关系不因父母离婚而改变。子女抚养权，主要取决于抚养条件。主要有这样几条原则：1、一周岁以下的子女，判给母亲抚养；2、哺乳期内的子女原则上判给母亲抚养；3、自幼由祖父母看护的，原则上判给父亲抚养；自幼由外祖父母看护的，原则上判给母亲抚养；4、那方收入多，有利于孩子健康成长原则上把孩子判给谁抚养；5、一方如果有过错或家庭暴力倾向，原则上不把孩子判给这一方抚养；6、一方有不可治愈的传染性疾病或无法自理的疾病，不适合抚养孩子，原则上不能把孩子判给这一方；7、十周岁以上的孩子，要征求孩子一件，原则上按孩子的愿望判决。,4
我和前妻离婚协议没写多长时间看一次孩子,当事人双方可以协商。探望是一种权利，即使没有约定多长时间看一次，有孩子抚养权的一方不能剥夺另一方对孩子的探望权。,9
工伤事故可否要求精神损害赔偿,“自然人因下列人格权利遭受非法侵害，向人民法院起诉请求赔偿精神损害的，人民法院应当依法予以受理：(一)生命权、健康权、身体权;(二)姓名权、肖像权、名誉权、荣誉权;(三)人格尊严权、人身自由权。违反社会公共利益、社会公德侵害他人隐私或者其他人格利益，受害人以侵权为由向人民法院起诉请求赔偿精神损害的，人民法院应当依法予以受理。”工伤精神损害赔偿应贯彻过错责任原则，即工伤是由劳动者故意或者重大过失造成的，以及用人单位对工伤事故的发生没有过错或者用人单位的过错对工伤事故的发生只起到次要作用，用人单位不应承担工伤精神损害赔偿责任。在工伤事故中，劳动者的过错行为是工伤事故发生的次要原因或者劳动者对工伤事故的发生没有过错，以及工伤事故是用人单位故意造成或者用人单位的过错是工伤事故发生的主要原因，用人单位应承担精神损害赔偿责任。,10
在我不情愿反抗的情况下男生强行发生性关系算是强奸吗,"根据刑法规定，强奸罪，是指违背妇女的意志，以暴力、胁迫或者其他手段强行与妇女发生性关系的行为。这一犯罪的主体一般是男子。教唆、帮助男子强奸妇女的女子，也可以成为强奸罪的共犯。强奸罪的客观行为为表现为违背妇女意志强行与妇女发生性关系。它具有以下特征:1、必须是违背了妇女的真实意愿。判断与妇女发生性关系是否违背妇女的意志，要结合性关系发生的时间、周围环境、妇女的性格、体质等各种因素进行综合分析，不能将妇女是否反抗作为判断是否违背妇女意愿的惟一要件。对于有的被害妇女由于受到威胁、害怕等原因而不敢反抗、失去反抗能力的，也应认定是违背了妇女的真实意志。同无责任能力的妇女(如呆傻妇女或精神病患者)发生性关系的，由于这些妇女无法正常表达自己的真实意愿，因此无论其是否""同意""，均构成强奸妇女罪。2、行为人必须以暴力、胁迫或者其他手段，强行妇女发生性关系的行为。这里所说的""暴力""手段，是指犯罪分子直接对被害妇女施以殴打或人身强制等危害妇女人身安全和人身自由，使妇女不能抗拒的手段:""胁迫""手段，是指犯罪分子对被害妇女施以威胁、恫吓，进行精神上的强制，以迫使妇女就范，不敢抗拒的手段。如以杀害被害人、加害被害人的亲属相威胁的;以揭发被害人的隐私相威胁的;利用职权、抚养关系、从属关系及妇女孤立无援的环境相胁迫等等。""其他手段""，是指犯罪分子使用暴力、胁迫以外的使被害妇女不知抗拒、无法抗拒的手段，如假冒为妇女治病而进行奸淫的;利用妇女患病、熟睡之机进行奸淫的;将妇女灌醉、麻醉后进行奸淫的等等。",6
我去法院起诉他能胜诉吗,起诉条件有：1、原告是与本案有直接利害关系的公民、法人和其他组织；2、有明确的被告；3、有具体的诉讼请求和事实、理由；4、属于人民法院受理民事诉讼的范围和受诉人民法院管辖。如果你满足以上条件就可以直接去法院起诉。是否胜诉还要看证据等情况,9
律师代写遗嘱去公证需要哪些材料,一般需要户口本和其他能够证明身份信息和其他证明人的身份材料,3
