title,reply,cluster
销售假冒卷烟会怎么定罪和处罚,销售假冒卷烟的行为有可能构成三种罪行的，包括生产、销售伪劣产品罪、侵犯知识产权罪、非法经营罪。我国《刑法》第140条规定，犯生产、销售伪劣产品罪，销售金额5万元以上不满20万元的，处2年以下有期徒刑或者拘役，并处或者单处销售金额50％以上2倍以下罚金；销售金额20万元以上不满50万元的，处2年以上7年以下有期徒刑，并处销售金额50％以上2倍以下罚金；销售金额50万元以上不满200万元的，处7年以上有期徒刑，并处销售金额50％以上2倍以下罚金；销售金额200万元以上的，处15年有期徒刑或者无期徒刑，并处销售金额50％以上2倍以下罚金或者没收财产。销售假冒注册商标的商品罪（第214条）：是指销售假冒他人注册商标的商品，销售金额较大的行为。本罪与假冒注册商标罪紧密相联，但只发生在流通领域。行为人必须明知是假冒商标的商品而故意出售，否则不构成本罪。其法定刑也分为两档：销售金额数额较大的，处三年以下有期徒刑或，并处或者单处罚金；销售金额巨大的，处三年以上七年以下有期徒刑，并处罚金。第二百二十五条违反国家规定，有下列非法经营行为之一，扰乱市场秩序，情节严重的，处五年以下有期徒刑或者拘役，并处或者单处违法所得一倍以上五倍以下罚金;情节特别严重的，处五年以上有期徒刑，并处违法所得一倍以上五倍以下罚金或者没收财产:(一)未经许可经营法律、行政法规规定的专营、专卖物品或者其他限制买卖的物品的;(二)买卖进出口许可证、进出口原产地证明以及其他法律、行政法规规定的经营许可证或者批准文件的;(三)其他严重扰乱市场秩序的非法经营行为。,10
被废除，再审时有新的法律，那再审时是否可以适用新法,刑法原则是从旧兼从轻。从旧兼从轻，是指在新法实施后发现的违法行为发生在新法实施之前，原则上适用旧法，新法没有溯及力，但新法不认为是违法或者处罚较轻时，则按照新法处理。具体执行中应按照不同情况分别处理：（1）旧法不认为是违法，而新法认为是违法，适用旧法，即新法没有溯及力。对于这种情况不能以新法规定其违法为由而追究责任。（2）旧法认为是违法，新法不认为是违法，应当适用新法，即新法具有溯及力。（3）旧法和新法都认为是违法，并且按照新法的规定应当追责的，原则按旧法追责，即新法不具有溯及力，这就是从旧兼从轻原则所指的从旧。但是如果旧法处罚比较新法处罚重，则应适用新法，新法具有溯及力，这便是从轻原则的体现。,10
2018年在押人减刑新规定,刑法规定：被判处管制、拘役、有期徒刑、无期徒刑的犯罪分子，在执行期间，如果认真遵守监规，接受教育改造，确有悔改表现的，或者有立功表现的，可以减刑；有下列重大立功表现之一的，应当减刑：（一）阻止他人重大犯罪活动的；（二）检举监狱内外重大犯罪活动，经查证属实的；（三）有发明创造或者重大技术革新的；（四）在日常生产、生活中舍己救人的;（五）在抗御自然灾害或者排除重大事故中，有突出表现的；（六）对国家和社会有其他重大贡献的。减刑以后实际执行的刑期，判处管制、拘役、有期徒刑的，不能少于原判刑期的二分之一；判处无期徒刑的，不能少于十年。,5
辞退工资补偿，哪些情况能领经济补偿金，经济补,劳动者被用人单位解除劳动关系（开除、解雇、炒鱿鱼），是否应该支付补偿或赔偿，大体分以下四种情况。1、用人单位与劳动者解除劳动关系，没有任何合法理由，也没有支付经济补偿或者没有履行合法程序，劳动者不存在《劳动合同法》第三十九条规定的情形，可以认定该用人单位行为属于《劳动合同法》第八十七条规定的违法解除的情形，应该支付赔偿金。标准为每工作一年支付2个月的本人工资，俗称2N；2、用人单位依据《劳动合同法实施条例》第十九条规定情形与劳动者解除劳动关系的，其中符合《劳动合同法》第四十六条规定的，应该支付劳动者经济补偿金，即每工作一年支付一个月本人工资，N；3、符合《劳动合同法》第四十条，并且没有提前1个月书面通知劳动者的，除了支付经济补偿金外，还应多支付1个月工资作为代通知金，总计N+1；4、如果劳动者存在《劳动合同法》第三十九条规定的情况，用人单位提出解除劳动关系的，不需要支付任何经济补偿，也不需要提前通知劳动者；但是，这需要用人单位举证并且书面通知劳动者解除劳动关系。《劳动合同法》第三十九条劳动者有下列情形之一的，用人单位可以解除劳动合同：（一）在试用期间被证明不符合录用条件的；（二）严重违反用人单位的规章制度的；（三）严重失职，营私舞弊，给用人单位造成重大损害的；（四）劳动者同时与其他用人单位建立劳动关系，对完成本单位的工作任务造成严重影响，或者经用人单位提出，拒不改正的；（五）因本法第二十六条第一款第一项规定的情形致使劳动合同无效的；（六）被依法追究刑事责任的。第四十条有下列情形之一的，用人单位提前三十日以书面形式通知劳动者本人或者额外支付劳动者一个月工资后，可以解除劳动合同：（一）劳动者患病或者非因工负伤，在规定的医疗期满后不能从事原工作，也不能从事由用人单位另行安排的工作的；（二）劳动者不能胜任工作，经过培训或者调整工作岗位，仍不能胜任工作的；（三）劳动合同订立时所依据的客观情况发生重大变化，致使劳动合同无法履行，经用人单位与劳动者协商，未能就变更劳动合同内容达成协议的。第四十六条有下列情形之一的，用人单位应当向劳动者支付经济补偿：（一）劳动者依照本法第三十八条规定解除劳动合同的；（二）用人单位依照本法第三十六条规定向劳动者提出解除劳动合同并与劳动者协商一致解除劳动合同的；（三）用人单位依照本法第四十条规定解除劳动合同的；（四）用人单位依照本法第四十一条第一款规定解除劳动合同的；（五）除用人单位维持或者提高劳动合同约定条件续订劳动合同，劳动者不同意续订的情形外，依照本法第四十四条第一项规定终止固定期限劳动合同的；（六）依照本法第四十四条第四项、第五项规定终止劳动合同的；（七）法律、行政法规规定的其他情形。第四十七条经济补偿按劳动者在本单位工作的年限，每满一年支付一个月工资的标准向劳动者支付。六个月以上不满一年的，按一年计算；不满六个月的，向劳动者支付半个月工资的经济补偿。劳动者月工资高于用人单位所在直辖市、设区的市级人民政府公布的本地区上年度职工月平均工资三倍的，向其支付经济补偿的标准按职工月平均工资三倍的数额支付，向其支付经济补偿的年限最高不超过十二年。本条所称月工资是指劳动者在劳动合同解除或者终止前十二个月的平均工资。第八十七条用人单位违反本法规定解除或者终止劳动合同的，应当依照本法第四十七条规定的经济补偿标准的二倍向劳动者支付赔偿金。《劳动合同法实施条例》第十九条有下列情形之一的，依照劳动合同法规定的条件、程序，用人单位可以与劳动者解除固定期限劳动合同、无固定期限劳动合同或者以完成一定工作任务为期限的劳动合同：（一）用人单位与劳动者协商一致的；（二）劳动者在试用期间被证明不符合录用条件的；（三）劳动者严重违反用人单位的规章制度的；（四）劳动者严重失职，营私舞弊，给用人单位造成重大损害的；（五）劳动者同时与其他用人单位建立劳动关系，对完成本单位的工作任务造成严重影响，或者经用人单位提出，拒不改正的；（六）劳动者以欺诈、胁迫的手段或者乘人之危，使用人单位在违背真实意思的情况下订立或者变更劳动合同的；（七）劳动者被依法追究刑事责任的；（八）劳动者患病或者非因工负伤，在规定的医疗期满后不能从事原工作，也不能从事由用人单位另行安排的工作的；（九）劳动者不能胜任工作，经过培训或者调整工作岗位，仍不能胜任工作的；（十）劳动合同订立时所依据的客观情况发生重大变化，致使劳动合同无法履行，经用人单位与劳动者协商，未能就变更劳动合同内容达成协议的；（十一）用人单位依照企业破产法规定进行重整的；（十二）用人单位生产经营发生严重困难的；（十三）企业转产、重大技术革新或者经营方式调整，经变更劳动合同后，仍需裁减人员的；（十四）其他因劳动合同订立时所依据的客观经济情况发生重大变化，致使劳动合同无法履行的。,1
法院强制执行后可以坐飞机吗,强制执行不等于已经纳入了失信人名单。也就是只有法院已经把失信人纳入了黑名单才不可以坐高铁、飞机出国、高消费等。,8
房子过户后租金是不是归买方,主要看合同约定，一般情况下，过户以后房子的产权归新房主所有，房子的租赁收益理应归新房主所有，买方不能单方终止租赁。,8
贩卖毒品6.3克判刑多久,【走私、贩卖、运输、制造毒品罪】走私、贩卖、运输、制造毒品，无论数量多少，都应当追究刑事责任，予以刑事处罚。走私、贩卖、运输、制造毒品，有下列情形之一的，处十五年有期徒刑、无期徒刑或者死刑，并处没收财产：(一)走私、贩卖、运输、制造鸦片一千克以上、海洛因或者甲基苯丙胺五十克以上或者其他毒品数量大的；(二)走私、贩卖、运输、制造毒品集团的首要分子；(三)武装掩护走私、贩卖、运输、制造毒品的；(四)以暴力抗拒检查、拘留、逮捕，情节严重的；(五)参与有组织的国际贩毒活动的。走私、贩卖、运输、制造鸦片二百克以上不满一千克、海洛因或者甲基苯丙胺十克以上不满五十克或者其他毒品数量较大的，处七年以上有期徒刑，并处罚金。走私、贩卖、运输、制造鸦片不满二百克、海洛因或者甲基苯丙胺不满十克或者其他少量毒品的，处三年以下有期徒刑、拘役或者管制，并处罚金；情节严重的，处三年以上七年以下有期徒刑，并处罚金。单位犯第二款、第三款、第四款罪的，对单位判处罚金，并对其直接负责的主管人员和其他直接责任人员，依照各该款的规定处罚。利用、教唆未成年人走私、贩卖、运输、制造毒品，或者向未成年人出售毒品的，从重处罚。对多次走私、贩卖、运输、制造毒品，未经处理的，毒品数量累计计算。,5
没有结婚证的怎么离婚,没有领取结婚证，就不存在法律上的夫妻关系，也就没有离婚这一说法。,4
公司不给加班费应该怎么办了,公司违反了劳动法，劳动法对每月或周工作时间及加班时间及加班费的计算都是有明确规定的，可以与单位进行协商，协商不成可以申请劳动仲裁。,1
无劳动合同工伤赔偿，计算方法是怎样的,用人单位未与劳动者签订劳动合同，只要劳动者是工伤，并且经劳动能力鉴定委员会鉴定为伤残等级的，用人单位就应当按照不同的伤残等级进行一定的赔偿，具体要根据伤残等级以及劳动者受工伤前的月平均工资来进行计算的。用人单位未与劳动者签订劳动合同的，劳动者可以要求用人单位支付双倍工资的。《中华人民共和国劳动合同法》第八十二条用人单位自用工之日起超过一个月不满一年未与劳动者订立书面劳动合同的，应当向劳动者每月支付二倍的工资。用人单位违反本法规定不与劳动者订立无固定期限劳动合同的，自应当订立无固定期限劳动合同之日起向劳动者每月支付二倍的工资。工伤保险待遇主要的补偿是：医疗费、一次性伤残补助金（个月本人工资）、一次性就业补助金（根据劳动者所在省的工伤条例确定，解除劳动关系时领取）、一次性医疗补助金（根据劳动者所在省的工伤条例确定，解除劳动关系时领取)、停工留薪期工资（根据劳动能力鉴定结论通知书确定）、伙食补助费、护理费、交通费等。根据《工伤保险条例》第三十七条及劳动者所在省的工伤保险条例的规定。第三十七条职工因工致残被鉴定为七级至十级伤残的，享受以下待遇：（一）从工伤保险基金按伤残等级支付一次性伤残补助金，标准为：七级伤残为13个月的本人工资，八级伤残为11个月的本人工资，九级伤残为9个月的本人工资，十级伤残为7个月的本人工资；（二）劳动、聘用合同期满终止，或者职工本人提出解除劳动、聘用合同的，由工伤保险基金支付一次性工伤医疗补助金，由用人单位支付一次性伤残就业补助金。一次性工伤医疗补助金和一次性伤残就业补助金的具体标准由省、自治区、直辖市人民政府规定。,1
20多年欠款(有借条)还能起诉法院吗?,诉讼时效：（1）普通诉讼时效：《民法通则》第一百三十五条：向人民法院请求保护民事权利的诉讼时效期间为二年，法律另有规定的除外。（2）短期诉讼时效：《民法通则》第一百三十六条下列的诉讼时效期间为一年：（一）身体受到伤害要求赔偿的；（二）出售质量不合格的商品未声明的；（三）延付或者拒付租金的；（四）寄存财物被丢失或者损毁的。（3）最长诉讼时效：《民法通则》第一百三十七条：诉讼时效期间从知道或者应当知道权利被侵害时起算。但是从权利被侵害之日起超过二十年的，人民法院不予保护。有特殊情况的，人民法院可以延长诉讼时效期间。,8
孩子四个月离婚归我还是男方，财产应该怎么分,新婚姻法规定的抚养权原则是，如果父母离婚，父母与子女的关系不因父母离婚而改变。子女抚养权，主要取决于抚养条件。主要有这样几条原则：1、一周岁以下的子女，判给母亲抚养；2、哺乳期内的子女原则上判给母亲抚养；3、自幼由祖父母看护的，原则上判给父亲抚养；自幼由外祖父母看护的，原则上判给母亲抚养；4、那方收入多，有利于孩子健康成长原则上把孩子判给谁抚养；5、一方如果有过错或家庭暴力倾向，原则上不把孩子判给这一方抚养；6、一方有不可治愈的传染性疾病或无法自理的疾病，不适合抚养孩子，原则上不能把孩子判给这一方；7、十周岁以上的孩子，要征求孩子一件，原则上按孩子的愿望判决。,4
继承人权利与义务有哪些，如何偿还被继承人债,以继承所得财产为限对被继承人的债务承担偿还责任。不足部分则由债权人自行承担。,0
因6000元彩礼杀人，彩礼怎样能退,这三种情况可以要回彩礼（一）双方未办理结婚登记手续的。意思就是给付彩礼后未缔结婚姻关系的，原则上应返还彩礼的，这是对于彩礼的原则性规定，大前提就是没有缔结婚姻，且已经给付了彩礼钱的情况。（二）双方办理结婚登记手续但确未共同生活的。这种情况是男女双方已经履行了结婚的必经法定程序，符合合法的婚姻关系，但是双方并没有真正的生活在一起的情况。（三）婚前给付并导致给付人生活困难的。彩礼钱是结婚前所给予对方的财物，一般数目也比较大，此种情况是指在给付给对方彩礼钱后，导致了给付方无法生活的情况。针对以上的条件，第一项是要在给付彩礼后，双方缔结婚姻前。而针对第二、三项的规定，是双方已经存在了合法的婚姻关系，但是应当以双方离婚为条件。,11
新房交了定金又想退怎么办？,如果是“定金”而不是“订金”，你即是退房了，“定金”不退。,8
贩卖毒品量刑是怎么样的,【走私、贩卖、运输、制造毒品罪】走私、贩卖、运输、制造毒品，无论数量多少，都应当追究刑事责任，予以刑事处罚。走私、贩卖、运输、制造毒品，有下列情形之一的，处十五年有期徒刑、无期徒刑或者死刑，并处没收财产：(一)走私、贩卖、运输、制造鸦片一千克以上、海洛因或者甲基苯丙胺五十克以上或者其他毒品数量大的；(二)走私、贩卖、运输、制造毒品集团的首要分子；(三)武装掩护走私、贩卖、运输、制造毒品的；(四)以暴力抗拒检查、拘留、逮捕，情节严重的；(五)参与有组织的国际贩毒活动的。走私、贩卖、运输、制造鸦片二百克以上不满一千克、海洛因或者甲基苯丙胺十克以上不满五十克或者其他毒品数量较大的，处七年以上有期徒刑，并处罚金。走私、贩卖、运输、制造鸦片不满二百克、海洛因或者甲基苯丙胺不满十克或者其他少量毒品的，处三年以下有期徒刑、拘役或者管制，并处罚金；情节严重的，处三年以上七年以下有期徒刑，并处罚金。单位犯第二款、第三款、第四款罪的，对单位判处罚金，并对其直接负责的主管人员和其他直接责任人员，依照各该款的规定处罚。利用、教唆未成年人走私、贩卖、运输、制造毒品，或者向未成年人出售毒品的，从重处罚。对多次走私、贩卖、运输、制造毒品，未经处理的，毒品数量累计计算。,11
起诉，请问夫妻个人债务可以执行共同财产吗,，需要结合债务形成的时间、用途等情况具体分析。一般一方婚前所负的债务，想配偶主张该权利的，法院不会支持。参考《婚姻法解释二》第二十三条债权人就一方婚前所负个人债务向债务人的配偶主张权利的，人民法院不予支持。但债权人能够证明所负债务用于婚后家庭共同生活的除外。,0
因涉嫌开设赌场罪，被刑事拘留，家人现应怎么做,建议及时委托律师会见，了解案件情况,11
行政案件可以请律师吗，律师在行政案件中能帮,律师可以代理行政诉讼，现在的行政诉讼是异地管辖。律师可以提供法律服务。律师法第二十八条律师可以从事下列业务：（一）接受自然人、法人或者其他组织的委托，担任法律顾问；（二）接受民事案件、行政案件当事人的委托，担任代理人，参加诉讼；（三）接受刑事案件犯罪嫌疑人、被告人的委托或者依法接受法律援助机构的指派，担任辩护人，接受自诉案件自诉人、公诉案件被害人或者其近亲属的委托，担任代理人，参加诉讼；（四）接受委托，代理各类诉讼案件的申诉；,1
担保人的诉讼时效哪天开始计算,保证人，有一般保证的保证人和连带责任保证的保证人二种。一般保证的保证人与债权人未约定保证期间的或未约定给付期间的，保证期间为主债务履行期届满之日起六个月。连带责任保证的保证人与债权人未约定保证期间的或未约定给付期间的，债权人有权自主债务履行期届满之日起六个月内要求保证人承担保证责任。,10
如果开车不小心把碰瓷的人撞死了犯法吗？,有证据证明交通事故的损失是由非机动车驾驶人、行人故意碰撞机动车造成的，机动车一方不承担赔偿责任。《道路交通安全法》第七十六条机动车发生交通事故造成人身伤亡、财产损失的，由保险公司在机动车第三者责任强制保险责任限额范围内予以赔偿；不足的部分，按照下列规定承担赔偿责任：机动车之间发生交通事故的，由有过错的一方承担赔偿责任；双方都有过错的，按照各自过错的比例分担责任。机动车与非机动车驾驶人、行人之间发生交通事故，非机动车驾驶人、行人没有过错的，由机动车一方承担赔偿责任；有证据证明非机动车驾驶人、行人有过错的，根据过错程度适当减轻机动车一方的赔偿责任；机动车一方没有过错的，承担不超过百分之十的赔偿责任。交通事故的损失是由非机动车驾驶人、行人故意碰撞机动车造成的，机动车一方不承担赔偿责任。,7
钱被骗了怎么办,公安局的人是会保密的，无论是县还是市的，都不会通知你的家人，你只管去公安局好了．不过，公安局的办案流程和效率我实在是不敢恭维．因为你只要填一张纸，问几句话，就可以走人了．如果你的事件正好在他们调查的事件范围之内，那么恭喜你，你可以扬眉吐气了，案子能查出来，不过钱是绝对拿不到了，上交国家了．如果你的事件公安局的档案袋里没有这个案子的调查令，那么你就回家等个十年八年，等这事闹大了，命令下来了，查出来了，不过你可能早把这事淡忘了．,2
出卖亲生子女是犯罪吗,其次，我国《收养法》第三十一条第三款规定，出卖亲生子女的，由公安部门没收非法所得，并处以罚款；构成犯罪的，依法追究刑事责任。其立法本意所讲构成犯罪，是指出卖自己亲生子女而触犯刑法条款的犯罪，是受刑法调整的犯罪，如遗弃罪。若要构成拐卖儿童罪，即使是亲生子女，还需具有《刑法》第二百四十条规定的六种情形之一，才能构成此罪。,6
十年不联系现在回来说离婚,在我国，离婚的方式有两种，一种是登记离婚，另一种是诉讼离婚。一、依照我国《婚姻法》第31条的规定，男女双方自愿离婚并且对子女的抚养及对财产的分割问题作出的适当的处理的，可以到婚姻登记机关进行登记离婚，不须进行诉讼。登记离婚时，要提供以下文件：1、户口本、身份证2、结婚证3、双方共同签署的离婚协议。建议你首先尽量说服他，和他进行登记离婚，尽量以和平的方式解决离婚问题。如果他实在不想离婚，而你坚持一定要离，那么，就只有进行离婚诉讼了。二、离婚诉讼。离婚诉讼是指夫妻中的一方基于法定离婚原因，向人民法院提起的、由人民法院对婚姻关系的维持与否进行判决的诉讼。离婚诉讼的手续（过程）如下：1、到人民法院向法院提起诉讼申请。一般是到立案大厅，由立案大厅进行审查，对于符合立案条件的，给予立案。如果你们双方不在同地居住的，则按“原告就被告”的原则，你要到男方的所在地提出诉讼。提出离婚诉讼申请时，须提供以下证件：A、请求判定离婚的起诉书（一式三份）B、户口本C、身份证（临时身份证、户籍证明、军官证、士官证、军队文职干部证等）D、结婚证2、经立案大厅审查符合立案条件，准予立案后，由立案庭发出立案通知书，你凭立案通知书缴纳诉讼费（50元）。法院正式受理案件。3、法院的立案庭受理案件后，将案件移送民事庭，由民事庭进行审理。4、民事庭受案后，向男方发出传票，要求其在某个时间到庭应诉。同时，法院也通知你到庭参诉。5、双方到庭后，由法院进行调解（这是必经程序）。调解的结果有3种：A.经调解后双方愿意维持婚姻的，则由你撤回起诉，婚姻继续有效。B.经调解后，他同意你的离婚请求的，并且对子女及财产问题作出处理的，则由你撤回起诉，由双方到婚姻登记机关进行登记离婚。C.经调解后，你仍坚持要求离婚而他不同意的，或双方同意但对子女及财产问题的处理存有争议的。则由法院进行审理判决。6、法院通过开庭审理，作出准予离婚或不准予离婚的判决。法院以双方感情是否确已破裂作为判决离婚的法定条件。其中，《婚姻法》第32条规定了准予离婚的以下例示性的法定理由：A.重婚或有配偶者与他人同居的B、实施家庭暴力或虐待、遗弃家庭成员的C.有赌博、吸毒等恶习，屡教不改的。D.因感情不和而分居满2年的E.其他导致夫妻感情破裂的情形,7
